{"$defs":{"SourceBundleFileV1":{"additionalProperties":false,"properties":{"relative_path":{"maxLength":4000,"minLength":1,"title":"Relative Path","type":"string"},"sha256":{"pattern":"^[0-9a-f]{64}$","title":"Sha256","type":"string"},"size":{"minimum":0,"title":"Size","type":"integer"}},"required":["relative_path","size","sha256"],"title":"SourceBundleFileV1","type":"object"}},"$id":"https://zmuxuny.github.io/hy3-learning-agent/evaluation/schemas/protocol-1.12/source-bundle-manifest-v1.schema.json","$schema":"https://json-schema.org/draft/2020-12/schema","additionalProperties":false,"properties":{"bundle_sha256":{"pattern":"^[0-9a-f]{64}$","title":"Bundle Sha256","type":"string"},"bundle_version":{"const":"evaluation-source-bundle-v2","title":"Bundle Version","type":"string"},"component":{"enum":["runtime","rules","judge","aggregate"],"title":"Component","type":"string"},"files":{"items":{"$ref":"#/$defs/SourceBundleFileV1"},"minItems":1,"title":"Files","type":"array"},"inclusion_policy":{"enum":["evaluation-package-conservative-v1","evaluation-and-product-runtime-conservative-v1"],"title":"Inclusion Policy","type":"string"},"schema_version":{"const":"source-bundle-manifest-v1","title":"Schema Version","type":"string"}},"required":["schema_version","bundle_version","component","inclusion_policy","files","bundle_sha256"],"title":"SourceBundleManifestV1","type":"object"}