{"bundle_sha256":"9f8def4c4cb3a043997f2b16434d4654dc51e7990c2de12a0b67a821f8e095d7","bundle_version":"evaluation-source-bundle-v2","component":"aggregate","files":[{"relative_path":"evaluation/src/learning_agent_eval/__init__.py","sha256":"6832c33c9478851d12cc60c768ecfdf46ab3ef90dbaa4edfb2c1fc1767c1ec93","size":1636},{"relative_path":"evaluation/src/learning_agent_eval/__main__.py","sha256":"6d2fc0507536ec4b96c656aeb4d9484267db8b5225e831bbc6ebbefb022baf02","size":96},{"relative_path":"evaluation/src/learning_agent_eval/_historical_aggregate.py","sha256":"0cfcd257cfedaa8a0efbcaabf1d5aa79d0e5d580246336f8297d89520e5ea5ff","size":26136},{"relative_path":"evaluation/src/learning_agent_eval/_historical_judge.py","sha256":"bc72fc804cf3f3f4ef526b9a5d755a31f11e27a432501c30f665fc032fa7c1fc","size":23958},{"relative_path":"evaluation/src/learning_agent_eval/_historical_rule_runner.py","sha256":"b05e1523b3cbf4005359fe14d824b07177034d1eaf098beb903568e167954874","size":12211},{"relative_path":"evaluation/src/learning_agent_eval/_historical_runner.py","sha256":"ae44674f6b9fddf97005dee5ec36631cb1074e57496b4015cfd57a7094155f11","size":14665},{"relative_path":"evaluation/src/learning_agent_eval/_historical_worker.py","sha256":"9d793fe94730bc4b230aedac263e19264b30a0d4a81836d715ad81e20a966082","size":13194},{"relative_path":"evaluation/src/learning_agent_eval/action_protocol.py","sha256":"734326fa32cec8c8cd622ef6c90a95a21638e176856a2d671ab4027450ef6d74","size":17923},{"relative_path":"evaluation/src/learning_agent_eval/active_aggregate.py","sha256":"7e0c0add0200480aefb9d0f0b9730e39e9c7041b9cbd93d91cf982565f6b9bb6","size":58293},{"relative_path":"evaluation/src/learning_agent_eval/active_judge.py","sha256":"8220086732ec3d1354888c975d52a655b37f91bb48c752d2a896425c88110ebe","size":69468},{"relative_path":"evaluation/src/learning_agent_eval/active_rules.py","sha256":"f83a9e445972d475e6d7c0e1855339ddf96d7c785bc6930c220c7898bfaa56ec","size":21725},{"relative_path":"evaluation/src/learning_agent_eval/active_runtime.py","sha256":"f74fd1dd4863272b929f1cda308033ec56e4372575fe03eff37791043674d99f","size":33344},{"relative_path":"evaluation/src/learning_agent_eval/active_worker.py","sha256":"c080595084facc1d98807a4379a5ae2141ad51efc7bfb4904c43a5a1f823b5ab","size":28384},{"relative_path":"evaluation/src/learning_agent_eval/aggregate.py","sha256":"427e13924fc461c203bc35474b435843bb2a54d54368b8a1499d8d9c3e0fbb22","size":425},{"relative_path":"evaluation/src/learning_agent_eval/aggregate_v2.py","sha256":"bd0388954a179e9eaa8c85ae543b59c252140ba0e3a505c1c14297f379f8ccef","size":703},{"relative_path":"evaluation/src/learning_agent_eval/blinding.py","sha256":"94f563d1c2b91c30c8a67fd18a93ed3867102c0d4e24a02dc696154fb7d5a8dd","size":9335},{"relative_path":"evaluation/src/learning_agent_eval/blinding_v2.py","sha256":"04c72cdfba490e7cdb594b467a982286e9beb1dd71a24ce2c47b3b07c715a3b9","size":13963},{"relative_path":"evaluation/src/learning_agent_eval/canonical.py","sha256":"de9b2dbe620434b4258807f8662663196a64ecbdf53a57eda49fe91e200ae985","size":2891},{"relative_path":"evaluation/src/learning_agent_eval/case_authoring.py","sha256":"859a8e47e3defbbaa01c43d09cb8ed6bd837b3fb78d72b39433fb3002757659d","size":6520},{"relative_path":"evaluation/src/learning_agent_eval/case_specs.py","sha256":"a524b4cd353b0ae2d12be422a00a14dd0f023a4380db9016fd6ce2ab671acbe5","size":8936},{"relative_path":"evaluation/src/learning_agent_eval/cli.py","sha256":"13ed1ab0279adc160bc33a0093d8026d3c4ffa45fda6494fc69fbeb6610e4d7b","size":14287},{"relative_path":"evaluation/src/learning_agent_eval/completeness.py","sha256":"143f294373916cedda49d786989724f68121fe64543701827f90bf72b161221c","size":3374},{"relative_path":"evaluation/src/learning_agent_eval/condition_challenge.py","sha256":"f58e44669873697e91cd4322fc1ca2766628126e856dd18ad53ee8a89d7b26ae","size":4890},{"relative_path":"evaluation/src/learning_agent_eval/delivery.py","sha256":"f9505c2675e09541d34c3ba3e7150c5361569e0020884ff4a034916b95e57c1a","size":3771},{"relative_path":"evaluation/src/learning_agent_eval/deltas.py","sha256":"2ef95871d06fb5c7a1a18ed069fcb29a63c55671f5199232cf66a7886afcccac","size":23108},{"relative_path":"evaluation/src/learning_agent_eval/e31_io.py","sha256":"c4373c207394d7f4cfb7b6a704d3919e54f4bc76abb3f0c0cc9e023da49cb27e","size":16723},{"relative_path":"evaluation/src/learning_agent_eval/e31_runtime.py","sha256":"e4a6661b814f2cf2cb9e700b65d1196923a23ed09215a8c4d4e159052f2c52a2","size":25483},{"relative_path":"evaluation/src/learning_agent_eval/e3_io.py","sha256":"24db6efde9a6d47ec54a8aa18179467ffeb9f4dd9a3680dd801412247fa3688a","size":11509},{"relative_path":"evaluation/src/learning_agent_eval/eligibility.py","sha256":"e7eea12d68dc1387ae0af45be482fa40b7f5609c03452cc9049767e580cfa0f3","size":1134},{"relative_path":"evaluation/src/learning_agent_eval/errors.py","sha256":"e1b31196ed6348b4fc0374837300d6d9d7aaf1c1f9a7691fb075b807044dd685","size":1536},{"relative_path":"evaluation/src/learning_agent_eval/exporter.py","sha256":"dd27a1ee4c4c3f05a0e5b585b231e1bc1a855e84e136b0af3ba82fec2b9694a6","size":46941},{"relative_path":"evaluation/src/learning_agent_eval/exporter_v3.py","sha256":"cd50b1f906757b61d514c2e12db37790658ef2d8ae394f5fe0e4ce8f7a669da2","size":10733},{"relative_path":"evaluation/src/learning_agent_eval/exporter_v4.py","sha256":"27a9af9d9252db621aefd4b11c32fa938a49a9ed930f438d56a4f4ad89b4ca10","size":27698},{"relative_path":"evaluation/src/learning_agent_eval/integrity.py","sha256":"39d1f750a93fcd6f766849071f371ed88bdb8c831fbae4c09c25c156d2070a26","size":5444},{"relative_path":"evaluation/src/learning_agent_eval/isolation.py","sha256":"308e672526b40d4ebb9fd49d4f7bcd49203e74929c7f97c63c3d0cf2abe662f7","size":8531},{"relative_path":"evaluation/src/learning_agent_eval/judge.py","sha256":"b4fd6352ee4999104fb4795712424bae41692060d66024d582c904c53ccd2648","size":412},{"relative_path":"evaluation/src/learning_agent_eval/judge_request_projection.py","sha256":"eac3d8e4b85cdaa2e6ca96164d10d3cc603b2d8857a78635fe8c63f0c58479f9","size":4036},{"relative_path":"evaluation/src/learning_agent_eval/judge_v2.py","sha256":"9988d5d27029f268751fb24d05465f099178f1bc5c9a9bef9b41867311411227","size":659},{"relative_path":"evaluation/src/learning_agent_eval/learning_quality.py","sha256":"ae4e21af17a643eb00ba1a45a962601c71a9889203b84e4b3ae51c62290dbc7e","size":16355},{"relative_path":"evaluation/src/learning_agent_eval/learning_quality_v10.py","sha256":"a4f202b6d5a3d6f5ca3e7e51fa79516ab81cb39073625940d262591d92a853a7","size":3053},{"relative_path":"evaluation/src/learning_agent_eval/learning_quality_v11.py","sha256":"af4549387a30952b8c309377f18740a0f19f1a492536f0f4adea65370301868a","size":1758},{"relative_path":"evaluation/src/learning_agent_eval/learning_quality_v2.py","sha256":"47da0b054b4556741f08e08721132f6e1f36e3f89ce4553bd45a4c0647eedb76","size":11375},{"relative_path":"evaluation/src/learning_agent_eval/learning_quality_v9.py","sha256":"0db0d6211d06b5c3450ad877b90f7583c27a002e936baa875043e4655b8c91dd","size":5657},{"relative_path":"evaluation/src/learning_agent_eval/legacy.py","sha256":"09cb83634c9518f9e4513f3233bd0e7b0c86585517813f9fd17ad88fdc4b1278","size":944},{"relative_path":"evaluation/src/learning_agent_eval/model_budget.py","sha256":"1211bb723f7e22640eea6e4629fe5f785a7c57b5ba73528fe810e0463f44e1dd","size":6671},{"relative_path":"evaluation/src/learning_agent_eval/models.py","sha256":"ae8ecf3ea3edf849a735833e4f0ed62694b4a3b6d7f1489da914de0522283e63","size":176941},{"relative_path":"evaluation/src/learning_agent_eval/normalizers.py","sha256":"3f133bc754c49eb535d36f8ee5a8cb630e5821261fdfb83a7c2227f4d9a952b2","size":12586},{"relative_path":"evaluation/src/learning_agent_eval/privacy.py","sha256":"38b37ba55a5960c83116c97693926147a15bfa9ace644c313199ead560b23039","size":8087},{"relative_path":"evaluation/src/learning_agent_eval/provider_config.py","sha256":"db5ea7f30f33c217343c8a06ebfd71c808e7f20b424eeaee484fb91fd8715882","size":1537},{"relative_path":"evaluation/src/learning_agent_eval/quality_claims.py","sha256":"b7eea78958b15c9fe3f8bb824d7f228655e086365677f79473d07ae1eccea713","size":4656},{"relative_path":"evaluation/src/learning_agent_eval/quality_content_audit.py","sha256":"5c4f914964f84e8986eff5d4dfb8c44fea05652a8bc79e91cf2e7a3ac5c36a41","size":5497},{"relative_path":"evaluation/src/learning_agent_eval/recorder.py","sha256":"fa95a827255a5dad74477596f5e7b8567042b168a2feed9c0fbe3609e38e31f7","size":19589},{"relative_path":"evaluation/src/learning_agent_eval/release_governance.py","sha256":"57a9aec7f69ff11350fa4295ccb3005ca8cbb2371c71fcaad85417b7f6fcb203","size":32239},{"relative_path":"evaluation/src/learning_agent_eval/resources.py","sha256":"d192c8790bd576c3a096c833e960cb4b5c4e324282b5caf48ba0f3221665aa7c","size":3140},{"relative_path":"evaluation/src/learning_agent_eval/rubric.py","sha256":"bbd6ca289e202120f9212b1132835b547d9c8ddf8b0ed7346647d7e6509b98fa","size":27668},{"relative_path":"evaluation/src/learning_agent_eval/rule_runner.py","sha256":"48cc0bca311a623ddf8fe70e2d4044e3e909816758956ba7dd85fc1120250b18","size":550},{"relative_path":"evaluation/src/learning_agent_eval/rule_runner_v2.py","sha256":"0c6945b99b94c178bcc8d8f19481387e21607a328498a3399c30850812031ab3","size":713},{"relative_path":"evaluation/src/learning_agent_eval/rules.py","sha256":"7d0a771bfce6efe79a9a4b95dcbe600613a89337a33ef2cf4f968ab5ad92c6ed","size":114792},{"relative_path":"evaluation/src/learning_agent_eval/runner.py","sha256":"5b7b1c81f4a17b5613eff47a9fee7c4ca165136fe99fe4e1f563ff53e44ac0c6","size":487},{"relative_path":"evaluation/src/learning_agent_eval/runner_v3.py","sha256":"842bf05af64f3733fceddf506e8ce96c315d78bbc925709e5c729642a7a125f3","size":587},{"relative_path":"evaluation/src/learning_agent_eval/runtime_fixture.py","sha256":"e1a8e51672eae169d6670a5a999be9e5aebd34e743992c500fc902a16c1cb152","size":10827},{"relative_path":"evaluation/src/learning_agent_eval/runtime_metadata.py","sha256":"2fa986712a6e080e64037edd6858792b718543